{
  "command_id": "aaaaaaaa-aaaa-4aaa-8aaa-aaaaaaaaaaaa",
  "connector_instance_id": "bbbbbbbb-bbbb-4bbb-8bbb-bbbbbbbbbbbb",
  "client_instance_id": "cccccccc-cccc-4ccc-8ccc-cccccccccccc",
  "session_key": "durable-root-1",
  "profile": "default",
  "client_request_id": "req-client-01",
  "method": "prompt.submit",
  "state": "succeeded",
  "completed_at": "2026-07-30T08:00:02Z",
  "revision": 2,
  "result": {
    "status": "accepted",
    "client_request_id": "req-client-01",
    "client_turn_id": "turn-client-01",
    "server_turn_id": "turn-server-09"
  }
}
